state_id,program_name,course_name,total_certification
12,NISHTHA 1.0,AN_Foundational Language and Literacy(FLN)_Batch2,63526
12,NISHTHA 1.0,AN_Foundational Numeracy(FLN)_Batch2,372537
12,NISHTHA 1.0,AN_Integration of ICT in Teaching,745
12,NISHTHA 1.0,AN_Pedagogy of Mathematics,865356
12,NISHTHA 2.0,AN_Pedagogy of Social Sciences,96
12,NISHTHA 2.0,AP_Pedagogy of Environmental Studies,52
12,NISHTHA 3.0,AN_Foundational Numeracy(FLN)_Batch2,558
12,NISHTHA 3.0,AN_Foundational Language and Literacy(FLN)_Batch2,68657